item,price,moq
 2016 Body Strong Shouler Press Fitness Equipment Gym Machine ,  US $1-1000  / Piece , 5 Pieces (Min. Order) 
 Standard 5-Station Integrated Exercise Machine/WNQ popular strength equipment/Multi-station trainer(WNQ-518BI) ,  US $180-800  / Set , 20 Sets (Min. Order) 
 Wholesale Best Selling Gym Fitness Equipment ,  US $331.0-331.0  / Sets , 1 Set (Min. Order) 
 Professional Commercial strength fitness equipment supplier with high quality Incline Bench ,  US $500-10000  / Set , 3 Sets (Min. Order) 
" new style outdoor fitness equipment,commercial gym equipment  ",  US $1-23  / Piece , 1 Set (Min. Order) 
 High quality Weight Bench with good quality ,  US $5-30  / Piece , 1 Piece (Min. Order) 
 New Functional Crosscore fitness suspension sling trainer NO MOQ ,  US $1-35  / Piece , 1 Piece (Min. Order) 
 Hot sale belt drive indoor cycling exercise bike ,  US $2.5-5.8  / Piece , 1 Piece (Min. Order) 
 nantong High quality exercise double wheel ab roller Abdominal Muscle Exercise AB Wheel Roller ,  US $2.2-3.0  / Piece | Buy Now , 150 Pieces (Min. Order) 
 AB Roller Abdominal Exercise Dual Wheel Body Strength Gym Home Fitness Training ,  US $6.5-12  / Pair , 50 Pieces (Min. Order) 
 Pull Up Strength Training 28mm Wooden Gym Ring ,  US $3.21-18.76  / Piece , 1 Pair (Min. Order) 
 12mm custom embossed thick baby play yoga mat as gym equipment with logo printed ,  US $0.33-1.5  / Meter , 504 Pieces (Min. Order) 
" Natural Latex Rubber Band, Rubber Latex Band, Yoga Band ",  US $1-220  / Set , 500 Meters (Min. Order) 
 2016 Hot Sale DC Motor Folding Mini Electric Treadmill For Home  ,  US $3-40  / Piece , 1 Set (Min. Order) 
 ProCircle Wholesale Exercise Custom Resistance Yoga Bands ,  US $190.0-210.0  / Set , 10 Pieces (Min. Order) 
 Body fit belt system spinning bike Les mills spin bike ,  US $5.8-9.6  / Set , 1 Set (Min. Order) 
" Resistance Band Set, Resistance Bands Wholesale, Latex Resistance Bands ",  US $5.5-8.1  / Piece , 500 Sets (Min. Order) 
 High quality most popular core roller wheel fitness ab carver for home gym equipment ,  US $0.5-1.8  / Piece , 200 Pieces (Min. Order) 
 hot selling variable resistance band and exercise band in latex ,  US $100-250  / Piece , 1000 Pieces (Min. Order) 
 New Multi Gym 100KG Weights Kraftstatio Fitness Equipment Multi Station Home Gym Heavy Duty Frame with Dumbbell Exercise Bench H ,  US $1-4000  / Piece , 1 Piece (Min. Order) 
 IE07 Portable Design ergometer mini elliptical trainer ,  US $8.5-12.5  / Unit , 1 Piece (Min. Order) 
 Wholesale Alibaba Home Gym Suspension Trainer Straps For Body Exercise ,  US $18.5-20  / Piece , 100 Units (Min. Order) 
 Home Gym X-FACTOR Stronger Body Power Gym Equipment ,  US $801-1199  / Set , 200 Pieces (Min. Order) 
 Commercial fitness Elliptical bike/orbitrac cross trainer with Wheels ,  US $179-418  / Set , 1 Set (Min. Order) 
 Commercial Health & Fitness Indoor Stationary Cycling Bike for Aerobic and Cardio Exercise and Training ,  US $1-50  / Piece , 1 Set (Min. Order) 
 Vertical dumbbell rack /commercial gym equipment/10 pairs dumbbell rack ,  US $1-14  / Piece , 10 Pieces (Min. Order) 
 Home Gym Fitness Trainer band/ Door Anchor suspension band ,  US $0.7-15  / Piece , 30 Pieces (Min. Order) 
 Wholesale Body Building Latex Resistance Band for Crossfit Exercise ,  US $1-800  / Piece , 50 Pieces (Min. Order) 
 10 cm White Gym Equipment /Gymnastic Tumbling Track ,  US $3.5-6.4  / Piece , 1 Piece (Min. Order) 
 ProCircle Fitness Latex Recovery Floss Band  ,  US $2-10.3  / Piece , 10 Pieces (Min. Order) 
 Wholesale Baby Training Muscle Massage Crossfit Gym Equipment  ,  US $100-300  / Piece , 1 Piece (Min. Order) 
 GS-842E New Design Indoor Motorized Treadmill fitness for Home Use ,  US $188-200  / Piece , 63 Pieces (Min. Order) 
 cardio equipment/fitness equipment/spinning bike LZX-9004/spinning sport ,  US $1-7  / Piece , 1 Piece (Min. Order) 
 High Quality Abdominal Exerciser Ab Wheel Professional 3 Wheels Ab Roller ,  US $20-1050  / Set , 100 Pieces (Min. Order) 
 Pilates cadillac/Wood cadillac reformer/Wood reformer with full trapeze ,  US $156.0-160.0  / Pieces , 1 Unit (Min. Order) 
 ASJ A001 High Quality Gym Equipment 2016 Commercial Fitness Equipment Chest Press for Fitness Club ,  US $0.95-1.98  / Kilogram , 1 Set (Min. Order) 
 1.0HP Multifunctional Electric Treadmill ,  US $1.0-1.0  / Square Meters , 30 Pieces (Min. Order) 
 rubber bumper weight plate ,  US $1-300  / Set , 1 Kilogram (Min. Order) 
" Factory price hot sale treadmill mat, treadmill floor/ exercise mat for Fitness Equipment ",  US $99-120  / Piece , 100 Square Meters (Min. Order) 
 Home Gym Heavy Duty Fitness Equipment Elliptical Exercise Machine ,  US $0.55-3.99  / Piece , 100 Sets (Min. Order) 
 Latest design health pink style body slimmer for girls ,  US $1-1000  / Set , 200 Pieces (Min. Order) 
